label	id	approved	datestart	dateend	name	shortname	hashtag	homepage	presentation form	onlinebanner	city	country	venue	OSM-Link	lat	lon	coclink	Self-description	cfpdate	cfplink	type	tags	EntranceFee	Registration	ParticipantsLastTime	Main language	Main Organiser	Specialties	First Edition	Main Sponsors	Edition’s Topic	Technologies in use	Online Interactivity	Technical Liberties	Timezone	Twitter	Mastodon	Telegram	Git*	Instagram	LinkedIn	Facebook	Youtube	Matrix	Mailinglist	cancelled	replacement	replaces	cancellation_description
Pas sage en seine			20200702	20200705	Pas sage en seine			https://passageenseine.fr/			Paris	FR	Médiathèque Louis Aragon	https://www.openstreetmap.org/way/235607926	48.7624	2.41479	https://passageenseine.fr/#coc	<p>Bienvenue chez vous !</p><p>Le festival Pas Sage En seine est un rendez-vous annuel de la région parisienne qui vient de fêter ses 10 ans déjà.</p><p>Lieu incontournable du milieu hacker à ses débuts, il a toujours eu pour vocation d’amener les citoyens de tous horizons à se réapproprier la société en bidouillant le système.</p><p>Initialement axé numérique, il s’est ouvert au fur et à mesure des éditions et traite aujourd’hui de sujets aussi variés que la politique, la justice, l’alimentation, les médias, la littérature, les sciences, les arts, le journalisme, le divertissement, l’inclusivité, l’accessibilité, le handicap…</p><p>L’entrée est libre et gratuite afin d’être accessible au plus grand nombre, sans discrimination de ressources.</p><p>Le thème de l’édition 2020 est : Bidouille, écologie & démocratie.</p>	20200416	https://participer.passageenseine.fr/	Festival				?	FR	White Rabbit PSES				Bidouille, écologie & démocratie. 					https://twitter.com/passageenseine													
Tübix			20200620	20200620	Tübix			https://www.tuebix.org/			Tübingen	DE	Gebäude auf dem Sand	https://www.openstreetmap.org/way/8044916#map=17/48.53476/9.07111	48.53476	9.07111	nococ	<p>Der Tübix ist ein Linuxtag und fand 2015-2018 jeweils im Juni in Tübingen statt. Die Folien (pdf) und Tonspuren (ogg) der vergangenen Jahre sind unter Downloads/Archiv zu finden.</p><p>Der Tübix könnte etwas für dich sein, falls du:</p><ul><li>… von anderen etwas dazulernen möchtest</li><li>… anderen etwas zeigen oder beibringen möchtest</li><li>… Experte / Profi / Veteran / Meister bist</li><li>… Neuling / Einsteiger / Umsteiger / Interessent bist</li><li>… nebenbei ein Computermuseum besuchen möchtest</li><li>… nebenbei ein 80cm-Teleskop ansehen möchtest</li></ul><p>Der Eintritt ist frei, dafür hilft jeder ein bisschen mit.</p>			Community Event	Linux	Zero	no	?	DE	Individual Organisers																						
Camp++			20210826	20210829	Camp++			https://camp.hsbp.org/2021/pp7e5/			Komárom	HU	Fort Monostor	https://www.openstreetmap.org/?mlat=47.750556&mlon=18.093889&zoom=15#map=15/47.7506/18.0939	47.7506	18.0938	nococ	"<p>The ""Hungarian Autonomous Center for Knowledge and friends"" runs the camp with the help of self-organized volunteer teams and on its own funds for the 8th year now. We are proud of this and we are looking forward to copying the inspiring example of independent self-organizing as championed by the organizers of the Chaos Communication Congress and Camps. We regard this event as one of the few places where a global exchange using the creative-critical approach to technology and society is possible without censorship.</p><p>We are not providing a stage to secret services or other state organizations. However, based on our concept and on the fact that work is done on a voluntary basis, a thorough advance screening of participants and speakers is not possible.</p><p>It goes without saying that everyone attending the camp should be treated with respect and consideration. A significant proportion of delegates and speakers value their privacy, the integrity of their own data and their photographic likenesses. Those who attach less importance to a personal agency in these matters are in a stronger position. We, therefore, ask them to respect the feelings and wishes of others.</p>"	20210519	https://camp.hsbp.org/2021/pp7e5/cfp.html	Camping, Community Event		~80€	https://camp.hsbp.org/2021/pp7e5/tickets.html	?	EN			2013																				
Technik Camp			20200813	20200816	Technik Camp			https://freifunk-bodensee.net/camp/			Überlingen	DE	Campus der Waldorfschule Überlingen	https://www.openstreetmap.org/way/195611475	47.77286	9.20193	nococ	Das Technik-Camp ist ein kleines internationales Treffen von Hackern, Technikbegeisterten und interessierten Bürgern. Vier Tage lang wird sich ausgetauscht und diskutiert, aber auch programmiert oder gebastelt. Es gibt ein Vortragsprogramm und Workshops, sowie gemeinsame Aktionen.			Camping, Community Event	CCC	?	?	?	DE	Freifunk	There is a basic food supply during the camp with long breakfasts and self-made dinners. Participants are kindly asked to help financially and logistically with food preparation. 								https://twitter.com/@FFBSee	https://chaos.social/@FFBSee		https://github.com/ffbsee/										
Flock			20220804	2022086	Flock			https://flocktofedora.org/	online	/img/eventbanners/2022/2022-flock.png								Flock is the Fedora Project's annual contributor-focused conference. It typically alternates between European and North American locations. The conference provides a venue for face to face meetings and conversations. It is also a place to celebrate our community.	20220715	https://pagure.io/flock/	Project Event	Fedora			?																								
Linux Bierwanderung			20200830	20200905	Linux Bierwanderung			https://linuxbierwanderung.com/			Kronberg	DE		https://www.openstreetmap.org/#map=14/50.1847/8.5027	50.1847	8.5027	nococ	<p>A Linux Bier Wanderung (engl. Linux Beer Hike) is a week-long event typically held in a small town in Europe where a group of like-minded open source enthusiasts gather to share knowledge, hike, enjoy various liquid refreshments (non-alcoholic and alcoholic) and first and foremost have fun! Everybody is expected to look after their own travel logistics including accommodation but the website promoting the event (including this one) typically offers some guidance and provides information about where to look and what to expect. The event is generally free of charge (ie. no registration fee or similar) but the costs of the Hall (rented by the organiser(s) of the event) is shared between the participants. The central purpose of the Hall is to serve as a base camp for the various activities and as a gathering place for meeting, sharing ideas, talks, etc. You can find more details here. There is also a mailing list covering various topics around the LBW and is used for communication between evetns (may require registration).</p><p>But back to this year's LBW and its location. With miles of well-kept trails and numerous sites, the Taunus is the ideal location for a week of hiking and other fun activities. Frankfurt with its variety of (craft) beer places is only half an hour away by public transport; Germany's biggest airport is only an hour by train. In addition to these amenities, Kronberg fulfils the following basic LBW rules:</p><ol><li>The hamlet must be able to be crossed within a short amount of time either on two or four legs.</li><li></li><li>One cannot get lost regardless of the state of intoxication.</li><li>The location must be remote enough to sever most ties with hipster urbanism.</li><li>It must have at least seven establishments which are serving as PotDs during the week.</li><li>A hall with decent internet connection and stable power supply is a prerequisite.</li></ol>			Unconference	Hiking,Linux,Beer	Participants are asked for a donation of ~30 Euro	<a href=”https://reg.linuxbierwanderung.com/16/”>available</a>	?	EN		In the morning we will usually meet in the hall, which serves as a meeting point for the week. There will likely be notices up for planned walks, excursions, talks, or other events. You can head off on one of these, or relax in the hall. In the evening a pub-of-the-day will be selected, and we will head there for food and drink. This year we have a kitchen in the hall, so cooking together there may well happen. 								https://twitter.com/linuxbierwander													
Wikimania			20190814	20190818	Wikimania			https://wikimania2019.wikimedia.org/			Stockholm	SE													?																								
OpenSym			20210915	20210917	OpenSym			http://opensym.org/ 	hybrid		Madrid	ES	Círculo de Bellas Artes de Madrid 	https://www.openstreetmap.org/way/4291319	40.4182	-3.69649	https://opensym.org/about-us/code-of-conduct/	<p>The 17th International Symposium on Open Collaboration (OpenSym 2021) is the premier conference on open collaboration research and practice, including open source, open data, open science, open education, wikis and related social media, Wikipedia, and IT-driven open innovation research.</p><p>OpenSym is the first conference series to bring together the different strands of open collaboration research and practice, seeking to create synergies and inspire new collaborations between people from computer science, information science, social science, humanities, and everyone interested in understanding open collaboration and how it is changing the world.</p><p>OpenSym 2021 will be a hybrid conference, from 15 – 17 September 2021. We will have on-line participants and participants physically in Madrid. We will have on-line sessions with on-line social activities and physical sessions in Madrid which will be broadcasted.</p>	20210603	https://opensym.org/os2021/call-for-papers/	Science Event	Open Collaboration	?	?	?	EN	OpenSym		2005				To be defined.	To be defined.	UTC+2	http://twitter.com/opensym													
LVEE			20190822	20190825	Linux Vacation / Eastern Europe	LVEE		https://lvee.org/en/			Minsk	BY							20190804	https://lvee.org/en/reports/abstract					?																								
Hacken Open Air			20220830	20220903	Hacken Open Air 2::22			https://www.hackenopenair.de/		/img/eventbanners/2022/2022-hackenopenair.svg	Gifhorn	DE	Pfadfinderheim Welfenhof	https://www.openstreetmap.org/#map=19/52.46289/10.60456	52.46289	10.60456	nococ	<p>Das Hacken Open Air ist feinstes Hacker-Camping, ausgerichtet vom Hackerspace Stratum 0. Wir versammeln uns zum gemütlichen Treffen mit Freunden und Bekannten.</p><p>Beim Hacken Open Air geht es um gemeinsames Basteln, Diskutieren und Grillen. Wir verzichten bewusst auf ein von uns organisiertes Vortragsprogramm. Stattdessen lassen wir euch Freiraum für selbstorganisierte Vorträge und Workshops.</p><p>Dieses Jahr campen wir am Pfadfinderheim Welfenhof in Gifhorn - 25km nördlich von Braunschweig.</p>			Camping, Unconference	Stratum 0	160 €	https://smaut.stratum0.org/hoa/hoa2022/	?	DE	Stratum 0																						
GUADEC			20210721	20210725	GNOME Users And Developers European Conference	GUADEC	#GUADEC	https://events.gnome.org/event/9/	online		The Internet						https://events.gnome.org/event/1/page/7-code-of-conduct	"<p>GUADEC is the GNOME community’s largest conference, bringing together hundreds of users, contributors, community members, and enthusiastic supporters together for a week of talks and workshops.Please note: due to the Coronavirus, GUADEC 2020 will be held online, and will return to Mexico in 2021. More details are available in <a href=""https://discourse.gnome.org/t/guadec-2020-moves-to-online-conference/3067"">GNOME's Discourse post</a>.</p>"	20210330	https://events.gnome.org/event/9/abstracts/	Project Event	Gnome	Zero	https://events.gnome.org/event/9/registrations/34/	?	EN	GNOME									https://twitter.com/GUADEC													
Wuthering Bytes			20200828	20200906	Wuthering Bytes			https://wutheringbytes.com/			Hebden Bridge	GB		https://www.openstreetmap.org/node/31248812#map=13/53.7407/-2.0094	53.7407	-2.0094	nococ				Festival		?	?	?	EN	Andrew Back and Tim Harbour									http://twitter.com/wutheringbytes													
ActivityPub Conference			20201002	20201005	ActivityPub Conference			https://conf.activitypub.rocks	online				On the internet				https://www.contributor-covenant.org/version/1/4/code-of-conduct/	<p>A conference about the present and future of ActivityPub, the world’s leading federated social web standard.</p><p>The 2020 virtual conference will include</p><ul><li>pre-recorded talks with live question and answer sessions</li><li>birds of a feather sessions</li><li>lightning round talks</li><li>a hackathon that follows the conference.</li></ul>	20200701	https://conf.activitypub.rocks/#cfp	Community Event	activitypub,fediverse	Zero	https://conf.activitypub.rocks/#register	First time online	EN							To be defined.	To be defined.															
Akademy	1674398102	yes	20230715	20230721	Akademy 2023		#Akademy2023	https://akademy.kde.org/	hybrid		Thessaloniki	GR	University of Macedonia				https://kde.org/code-of-conduct/	<p>The conference is expected to draw hundreds of attendees from the global KDE Community to discuss and plan the future of the Community and its technology. Many participants from the broad free and open source software community, local organizations and software companies will also attend.</p><p>Akademy features a 2-day conference with presentations on the latest KDE developments, followed by 5 days of workshops, Birds of a Feather (BoF) and coding sessions. It is an opportunity to meet key KDE contributors, learn about the latest features and enjoy the great atmosphere. You will meet developers, artists, translators, upstream and downstream maintainers, users, and free and open software industry leaders from all over the world.</p><p>Akademy 2023 will be a hybrid event, in Thessaloniki & online from Saturday 15th - Friday 21st July 2023</p>			Project Event	KDE	Zero		?	EN	KDE e.V.										https://mastodon.technology/@kde							#akademy:kde.org					
Linux Plumbers Conference			20220912	20220914	Linux Plumbers Conference			https://lpc.events/		/img/eventbanners/2022/2022-lpc.png	Dublin	IE							20220612	https://lpc.events/event/16/abstracts/					?	EN																							
LibreOffice Conference			20201013	20201016	LibreOffice Conference			https://conference.libreoffice.org/2020/	online		Nürnberg	DE						<p>Organizers of the openSUSE + LibreOffice Conference, along with the project’s boards, have made the decision to change the conference to an online conference.</p>	20200721	https://events.opensuse.org/	Project Event	Libre Office			?	EN							To be defined.	To be defined.	UTC+2														
Cloud Foundry Summit Europe			20190911	20190912	Cloud Foundry Summit Europe			https://www.cloudfoundry.org/event/eusummit2019/			The Hague	NL													?																								
Kernel Maintainer Summit			20190912	20190912	Kernel Maintainer Summit			https://events.linuxfoundation.org/events/linux-kernel-maintainer-summit-2019/			Lisbon	PT													?																								
BalCCon2k21			20211001	20211003	Balkan Computer Congress 2021	BalCCon2k21	#BalCCon2k21	https://2k21.balccon.org/ 	online				On the Internet					<p>Our major goal is to gather all the communities from the region and abroad so we can socialize, hack, play, learn, exchange knowledge and experience and of course, party together.</p><p>BalCCon is a non commercial, community organized event, with talks and workshops by the community for the community. We are aiming to become the center of the hacker community in the region as well as to provide an opportunity for all the people in this part of Europe to connect and to cooperate.</p>			Community Event	CCC	?	?	?	EN		Assembly space, Rakia Leaks				?				https://twitter.com/BalCC0n													
TechParty			20190914	20190914	TechParty			http://techparty.online/			Madrid	ES													?																								
Nextcloud conference			20190914	20190915	Nextcloud conference			https://nextcloud.com/conf/			Berlin	DE													?																								
Bitkom Forum Open Source			20210916	20210916	Bitkom Forum Open Source			https://www.bitkom.org/bfoss19	hybrid		Erfurt	DE	Steigerwaldstadion	https://www.openstreetmap.org/way/37437787	50.9603	11.0374		<p>Open Source ist in der deutschen Wirtschaft angekommen, das belegen die Zahlen des Bitkom Open Source Monitors 2019 ganz klar. Der Einsatz und die Nutzung von Open Source gehört für viele Unternehmen und Organisationen zum täglichen Geschäft und so fällt ein Bekenntnis zu Open Source durchweg positiv aus. Doch die weiteren Schritte und Möglichkeiten im Umgang mit Open Source sind häufig noch nicht so klar: Open Source, Ja! Und jetzt?</p><p>Das 7. Forum Open Source will sich mit den Chancen, Potenzialen und Möglichkeiten von Open Source auseinandersetzen und insbesondere beleuchten, wie Open Source erfolgreich in Organisationen gelebt werden kann.</p><p>Das Forum Open Source findet am Donnerstag, 16. September 2021, 10:00 – 17:00 Uhr  statt.</p><p>Nach aktuellem Stand planen wir eine Präsenzveranstaltung und haben dafür die Arena Erfurt im Steigerwaldstadion (Mozartallee 3, 99096 Erfurt (Lage)) optioniert. Sollte eine Präsenzveranstaltung auf Grund der weiteren Pandemie-Entwicklung nicht möglich sein, werden wir das Forum in einem Online-Format durchführen.</p><p>Die Teilnahme am Forum ist kostenfrei.</p>	20210326	https://www.bitkom.org/bfoss21	Business Event	Bitkom	Zero	https://www.bitkom.org/formular/AnmeldungBitkom-Forum-Open-Source-2021	?	DE	Bitkom																						
Owncloud Conference			20190917	20190920	Owncloud Conference			https://conference.owncloud.org/			Nuremberg	DE													?																								
End Summer Camp			20200902	20200906	End Summer Camp 2K20	ESC		https://www.endsummercamp.org/			Venezia Tessera	IT	Forte Bazzera	https://www.openstreetmap.org/#map=17/45.49790/12.33106	45.4979	12.32972	nococ	ESC è un incontro non-profit di persone interessate all'Hacking, al Software Libero e al DIY. Il contenuto dell'evento è in continua evoluzione e viene creato dai suoi partecipanti.			Camping, Community Event		?	?	?	?	?																						
Datenspuren			20190920	20190922	Datenspuren			https://wiki.c3d2.de/Datenspuren_2019			Dresden	DE													?																								
Hackmeeting			20190920	20190922	Hackmeeting			https://es.hackmeeting.org/hm/index.php?title=Hackmeeting2019			Errekaleor-Gasteiz	ES													?																								
FixFest_Reparatur-Festival			20190920	20190922	FixFest_Reparatur-Festival			https://reparatur-festival.runder-tisch-reparatur.de/			Berlin	DE													?																								
CH Open Workshop Tage			20220906	20220908	CH Open Workshop Tage 2022			https://workshoptage.ch/		/img/eventbanners/2022/2022-ch-open.png	Bern	CH	Berner Fachhochschule Wirtschaft	https://www.openstreetmap.org/node/443520918	46.94246	7.44030	nococ	<p>An den Workshop-Tagen dreht sich während dreier Tage in verschiedenen, eintägigen Workshops alles um bekannte und aktuelle Themenwelten rund um Open Source Software und Technologien sowie Soft Skills aus diversen Bereichen. Es bleibt auch Zeit für den Austausch und das Networking. Ein Muss für alle OS-Liebhaber und Entdecker.</p>	20220513	https://workshoptage.ch/call-for-proposals-2022/	Community Event		?	?	?	DE	CH Open																						
JoomlaDay™ Deutschland, Österreich & Schweiz			20220923	20220924	JoomlaDay™ Deutschland, Österreich & Schweiz		#	https://www.joomladay.de/		/img/eventbanners/2022/2022-joomladay-de.png	Bad Hersfeld	DE	Hotel am Kurpark	https://www.openstreetmap.org/node/393516266	50.8627092	9.6993000	nococ				Project Event	Joomla	?	?	?	DE				reDim GmbH, BackupMonkey, gn2 Hosting, Mittwald, formativ.net GmbH, Akeeba Ltd			To be defined.	To be defined.	UTC+2														
Software Freedom Day			20210918	20210918	Software Freedom Day	SFD	#SFD	http://www.softwarefreedomday.org/													Global Day																												
State of the Map			20220819	20220821	State of the Map			https://2022.stateofthemap.org/		/img/eventbanners/2022/2022-state-of-the-map.svg	Florence	IT					https://2022.stateofthemap.org/codeofconduct/	State of the Map is the annual event for all mappers and OpenStreetMap users. In 2022 the State of the Map conference will be a three day hybrid conference taking place in Florence, Italy and online.	20220425	https://2022.stateofthemap.org/calls/general/	Community Event, Project Event	OSM,OpenStreetMap	Zero		?	EN	Openstreetmap Foundation		<a href=”https://2007.stateofthemap.org/”>2007</a>						UTC	https://twitter.com/sotm							https://www.youtube.com/channel/UCLqJsr_5PfdvDFbgv1qp2aQ						
FediConf			20200925	20200927	FediConf			https://fediconf.org/			Barcelona	ES	Lleialtat	https://www.openstreetmap.org/way/264735742#map=19/41.37293/2.13680	41.37293	2.1368	nococ	<p>The FediConf is a place where everyone interested in Free social networks, Descentralized technology and Free software can meet in person, share experiences, concerns, and progress in our fight for a better Internet.</p><p>Talks, debates and workshops during one weekend to put in common our interests and doubts, and to learn from each other.</p><p>--</p><p>La FediConf és un espai de trobada on totes aquelles persones interesades en les Xarxes Socials Lliures, la tecnología descentralitzada i el Software Lliure es poden probar en persona, compartir experiències, preocupacions i progressos en la nostra lluita per un internet millor.</p><p>Xerrades, taules de debat i tallers durant un cap de setmana per tal d'aunar interessos comúns, dubtes i aprenentatge.</p><p>--</p><p>La FediConf es un espacio de encuentro donde todas aquellas personas interesadas en las Redes Sociales Libres, la tecnología descentralizada y el Software Libre se pueden encontrar en persona, compartir experiencias, preocupaciones y progresos en nuestra lucha por un internet mejor.</p><p>Charlas, mesas de debate y talleres durante un fin de semana con el objetivo de aunar intereses comunes, dudas y aprendizaje.</p>	open	https://formularis.lleialtat.cat/fediconf-speakers	Community Event	Fediverse	?	?	?	CA/EN/ES	?										https://libertalia.world/@fediconf												
Open Networking Summit			20190923	20190925	Open Networking Summit	ONS		https://events.linuxfoundation.org/events/open-networking-summit-europe-2019/			Antwerp	BE													?																								
INFORMATIK 2022			20220926	20220930	INFORMATIK 2022			https://informatik2022.gi.de/		/img/eventbanners/2022/2022-informatik.jpg	Hamburg	DE	UHH Gebäude, Universität Hamburg	https://www.openstreetmap.org/node/587673450	53.5624438	9.9889343		<p>Die #INFORMATIK2022 ist die offizielle Jahrestagung der Gesellschaft für Informatik e.V. (GI), der größten Vereinigung der Informatikerinnen und Informatiker im deutschsprachigen Raum und wird jährlich an wechselnden Orten veranstaltet. Die 52. Jahrestagung INFORMATIK 2022 findet vom 26. bis 30.09.2022 in Hamburg als Präsenzveranstaltung statt.</p><p>Das Rahmenthema der INFORMATIK 2022 ist „Informatik in den Naturwissenschaften“. Dieses Thema fokussiert auf die Synergien der verschiedenen Naturwissenschaftsdisziplinen mit der Informatik. Naturwissenschaften beobachten und ergründen die Natur durch Empirie und Experimente, um sie verstehbar und nutzbar zu machen. Die Informatik nimmt dabei eine besondere Rolle ein, indem sie komplexe Analysen und Vorhersagen ermöglicht und große Datenmengen verarbeitet, verwaltet und visualisiert. Einerseits bedienen sich die Naturwissenschaften dabei der Informatik als Werkzeug, andererseits ist die Natur in den verschiedenen Bereichen der Informatik ein Vorbild und Quelle für Inspiration.</p><p>Neben Beiträgen zum Schwerpunktthema gibt die INFORMATIK 2022 einen Einblick zu weiteren Themen, die aktuell besondere Aufmerksamkeit in Wissenschaft, Praxis und Gesellschaft erfahren. Dies sind z. B. Web Science, Data Science, Internet of Everything, Sichere und zuverlässige Systeme, KI, Autonomes Fahren und Mobilität, Quantencomputing, Digital Health, Green Coding, Robotik, Industrie 4.0, Software Engineering, Computerethik sowie Informatik-Didaktik.</p><p>Auf der INFORMATIK 2022 bringen wir Gesprächspartnerinnen und -partner aus Wissenschaft, Politik und Wirtschaft zusammen, beleuchten gesellschaftliche und politische Zusammenhänge und suchen den Dialog mit allen Interessierten.</p>							?	DE	Gesellschaft für Informatik e.V.																						
educode			20190927	20190927	educode			https://educode.be/			Brussels	BE													?																								
Percona Live			20210512	20210513	Percona Live			https://www.percona.com/live/conferences	online	/img/eventbanners/2021/2021-percona-live.png			On the internet				https://www.percona.com/live/conferences/attend	<p>Percona Live is a community-focused event for database developers, administrators, and decision-makers to network with peers and technology professionals. Come learn from the best and brightest of the open source database community as they share their knowledge, experience, and use cases with you in small group sessions and tutorials.</p><p>Format</p><p>The conference will be held online in 2021 and be run over 2 days. We will have multiple tracks on various technologies and use cases and accessible overall time zones.</p><p>Our conference platform is heavily focussed on attendee experience and engagement and we think this is an awesome opportunity to get together virtually and chat and talk with like-minded people!.</p>	20210228	https://cfp.percona.com/	Project Event		Zero	https://cfp.percona.com/	?	EN						Youtube, Twitch, Slack				https://twitter.com/percona			https://github.com/percona		https://www.linkedin.com/company/percona								
