label	id	approved	datestart	dateend	name	shortname	hashtag	homepage	presentation form	onlinebanner	city	country	venue	OSM-Link	lat	lon	coclink	Self-description	cfpdate	cfplink	type	tags	EntranceFee	Registration	ParticipantsLastTime	Main language	Main Organiser	Specialties	First Edition	Main Sponsors	Edition’s Topic	Technologies in use	Online Interactivity	Technical Liberties	Timezone	Twitter	Mastodon	Telegram	Git*	Instagram	LinkedIn	Facebook	Youtube	Matrix	Mailinglist	cancelled	replacement	replaces	cancellation_description
Open 2020			20200611	20200612	Open 2020				online	/img/eventbanners/2020/2020-open2020-reinvented.jpg			On the internet					<p>OPEN 2020 is a collaborative online event for anyone that is interested in creating a world which places people and planet before profit.</p><p>Recognising that there are hundreds of thousands of groups and communities working on this general objective… but a lack of inter-connection and collaboration, OPEN 2020 aims to bring together as many people as possible from different communities and commons building projects, to collectively figure out:</p><p>How to enable small groups to form, exchange ideas, define shared purposes, to collaborate effectively, and trade – within a global network of like minded commons building initiatives.</p><p>We could be so much more effective if we gathered around a single platform or shared information via a single protocol in order to benefit from ‘the network effect’ of a united ‘cooperative advantage’. This is our chance to co-create the future we want, together!</p>			Community Event	commons, non-profit	1367.39 GBP	https://opencollective.com/open-coop/events/open-2020-networked-commons-initiatives-9b91f4ca#section-tickets	150 – now first time online	EN	The Open Co-op		2017		Reinvented	To be defined.																	
Zukunft für alle			20200825	20200830	Zukunft für alle			https://zukunftfueralle.jetzt/	online				On the internet					<p>Der Zukunft Für Alle Kongress findet statt. Auf einem digitalen Kongressgelände erwarten euch mehr als 200 Workshops, 13 Fachpodien sowie vier Abendpodien zu den großen Fragen zu einer Zukunft Für Alle. Außerdem gibt es ein vielfältiges nicht-digitales Kunst- und Kulturprogramm in Leipzig. Thematisch ist das Programm in 15 Themenstränge untergegliedert.</p><p>Wir freuen uns auf mehr als 250 Sprecher*innen und Referent*innen, darunter zum Beispiel Natasha A. Kelly, Bini Adamczak, Nilüfer Koç (Ko-Vorsitzende des Kurdischen Nationalkongresses), Uwe Meinhardt (Vorstand IG Metall für Grundsatzfragen und Gesellschaftspolitik), Alassane Dicko (afrique-europe interact, Mali), Lann Hornscheidt und Dagmar Paternoga (attac).</p><p>Neben dem Workshop- und Podienprogramm wird es diverse digitale und analoge Kunst- und Kulturveranstaltungen geben. Auf dem digitalen Kongressgelände wird es zudem die Möglichkeit geben, sich informell auszutauschen; in öffentlichen Räumen ebenso wie im kleineren Kreis oder in geschützten Räumen wie zum Beispiel BIPoC-Empowerment-Räumen.</p>			Community Event		70 € (recommended donation)	yes	First Edition	DE	Konzeptwerk Neue Ökonomie																						
rC3 – remote Chaos Experience			20201227	20201230	rC3 – remote Chaos Experience	rC3	#rC3		online			DE	On the internet					<p>This year, CCC hosts the Remote Chaos Experience (rC3) instead of an on-site event in Leipzig. This endeavor requires creativity, joy of experimentation and active support.</p><p>A face-to-face event with 17,000 people will be neither responsible nor legally feasible this year. But after this tedious and painful 2020, we really deserve a nice finale! This is why the rC3 – Remote Chaos Experience will be held. As much as virtually possible, we want to convey the joy, content, togetherness and wonderful madness that make up a Chaos Communication Congress.</p><p>Hackers are used to remote work and online meetings. This makes our annual face-to-face meetings all the more important. Of course, it will be difficult to re-enact online all the things that make Congress what it is for us. But then someone said it would be impossible. Our ambition was aroused.</p><p>Just like every year, we want to see the concentrated energy and creativity of hackers with dedication. What can I expect?</p><p>rC3 will be a variety of distributed small local events in hackspaces with a joint program of streamed talks, online workshops, art, culture and various forms of networked togetherness..</p>			Community Event	ccc	?	?	17.000 – Now first time online	DE	Chaos Computer Club		1984			To be defined.	To be defined.	To be defined.	UTC+1														
Arch Conf			20201010	20201011	Arch Conf Online 2020	Arch Conf	#Arch Conf	https://conf.archlinux.org/	online				On the internet					<p>During the weekend of 10th and 11th of October there is going to be an online Arch Linux conference. The details are currently being worked on, but the Call for Participation has been published and people can submit their talk ideas until the 18th of September.</p><p>All talks are expected to be recorded as it will ease the planning for the live portion of the stream, however there are going to be live Q&A session with the presenters if they are available. For accepted submissions the recording should be submitted no later then 7 days prior to the conference. Information how to record a talk is available on the conference page.</p><p>For any questions please email archconf@archlinux.org</p><p>Cheers from the conference team!</p>			Community Event	arch linux	Zero	no	20	EN	Arch Linux	Pacman, Packaging	Arch Conf was first held in 2010, and a second iteration was held in 2019			To be defined.	To be defined.	To be defined.															
CMS UnConference / Open Web Lounge 2020			20201016	20201018				https://www.open-web-lounge.org/	online				On the internet					<p>This year as an online event, fully powered by self-hosted free and open source software (i. e. no Zoom & Co). Free as in free beer!</p><p>The offical CMS Garden conference is an UnConference or BarCamp: Any session (prepared or spontaneously) will be announced informally. You may announce your topic wishlist as well. Usually there will be someone willing to hold a lecture on it. We know from many common activities that it need no more organization than this for a fertile sharing of expertise. Let yourself be inspired, educated, enthused!</p><p>This year will be different because of known reasons: It will be an online barcamp. Stay tuned for detailed information!</p>		https://openspacer.org/177-cms-garden-unconference/252-cms-unconference-open-web-lounge-2020/?_locale=de	Unconference		Zero	yes	?	EN	CMS Garden	Bring your (!) own topics, no matter if you can hold a lecture, just want to suggest a session topic or invite to a discussion. 	?			To be defined.	To be defined.	To be defined.															
Nextcloud Conference 2020			20201003	20201004	Nextcloud Conference 2020			https://nextcloud.com/conf-2020/	online				On the internet				https://nextcloud.com/community/code-of-conduct/	<p>Annually bringing the global Nextcloud Contributor Community together for a week of coding, design, discussion, talks & fun.</p><p>Join from wherever you are - the event is taking place as a live online event space 🛰</p>			Project Event	nextcloud	Zero	yes	?	EN	Nextcloud Gmbh				Home Office	To be defined.	To be defined.	To be defined.															
Flisol A Coruña			20200926	20200926	Flisol A Coruña 2020			https://flisol2020acoruna.gitlab.io/index.html	online	/img/eventbanners/2020/2020-flisol-a-coruna.png			On the internet					<p>El FLISoL es el evento de difusión de Software Libre más grande en Latinoamérica y está dirigido a todo tipo de público: estudiantes, académicos, empresarios, trabajadores, funcionarios públicos, entusiastas e incluso personas que no poseen mucho conocimiento informático.</p><p>La entrada es gratuita y su principal objetivo es promover el uso del software libre, dando a conocer al público en general su filosofía, alcances, avances y desarrollo.</p>			Community Event	flisol, melisa, bricolabs, amtega, galicia	Zero	no	?	ES	Asociación de usuarios de software libre da Terra de Melide (Melisa) & BricoLabs			Axencia para a Modernización Tecnolóxica de Galicia (Amtega) & Xunta de Galicia 		Youtube, RocketChat, BigBlueButton	To be defined.	To be defined.	UTC+2				https://gitlab.com/flisol2020acoruna										
L1brecon2022			20221115	20221116	L1brecon 2022			https://www.librecon.io	offline	/img/eventbanners/2022/2022-librecon.png 	Bilbao	ES	Palacio Euskalduna	https://www.openstreetmap.org/way/174088299	43.26701	-2.94466	nococ	<p>LIBRECON está organizado por ESLE, la asociación de empresas de tecnologías libres y conocimiento abierto de Euskadi.</p><p>LIBRECON, cuya última edición presencial celebrada también en Bilbao en 2018 congregó a cerca de 1.000 asistentes, llega en un momento de máximo interés en torno a las tecnologías OPEN debido a la pandemia. La transformación digital acelerada por la COVID 19 ha visibilizado la importancia de tener industria propia en sectores estratégicos como lo es la tecnología. Por ello, desde ESLE se impulsa un año más LIBRECON para mostrar soluciones open source en Teletrabajo, Teleeducación, E-commerce y Transformación digital en la administración pública entre otros ámbitos que han experimentado un tsunami en los últimos años y que necesitan de soluciones.</p><p>El evento busca ser el punto de encuentro y referencia para conocer las últimas tendencias en tecnologías abiertas aplicadas a sus ámbitos de trabajo y para intercambiar conocimientos que fomenten el desarrollo de negocios.</p><p>En definitiva, los modelos de trabajo open y las tecnologías abiertas tienen ante sí la oportunidad de posicionarse estratégicamente como solución a una necesidad de innovación tecnológica en un entorno cambiante. Una realidad que se escribe en código abierto.</p>	20220801	https://docs.google.com/forms/d/e/1FAIpQLSdjgNzOJzWL5H9NtqNQI0EJx3Ay2HrRhj3VKa_3CObNJh8_Pw/closedform	Exhibition	else, asolif	Zero		?	ES	ESLE & ASOLIF		2018	Singular, Google	Reinventing Openness				UTC+2	https://mobile.twitter.com/librecon					https://es.linkedin.com/in/librecon	https://www.facebook.com/librecon							
Akademy-es			20201120	20201122	Akademy-es 2020			https://www.kde-espana.org/akademy-es-2020	online			ES	On the internet					<p>Akademy-es es el encuentro anual de desarrolladores, colaboradores y usuarios de KDE en España, que se celebra desde el año 2006 en distintas ciudades del territorio español y con ésta se llegará a la decimoquinta edición.</p><p>Este año Akademy-es 2020 se celebrará en línea aprovechando las tecnologías libres de telecomunicaciones del 20 al 22 de Noviembre</p>	20201018	https://www.kde-espana.org/akademy-es-2020/presenta-tu-charla	Community Event	KDE,	Zero	?	?	ES	KDE España					To be defined.	To be defined.	To be defined.	UTC+2														
Tux-Tage			20221111	20221113	Tux-Tage 2022			https://www.tux-tage.de/	online	/img/eventbanners/2022/2022-tuxtage.png			On the internet					<p>Nach dem Event ist vor dem Event! Wir starten aktuell mit den Vorbereitungen für die Tux-Tage 2022: Eine Veranstaltung mit Vorträgen, Talks, Workshops und mehr angesiedelt in der Welt der Freien Software. Wie im letzten Jahr wird es wieder die Möglichkeit geben, Vorträge zu halten und miteinander ins Gespräch zu kommen.</p><p>Während viele Veranstaltungen in die Präsenz-Form wechseln, wird unsere Veranstaltung weiterhin ausschließlich online stattfinden. Für Networking-Möglichkeiten um miteinander ins Gespräch zu kommen werden wir sorgen. Lasst euch überraschen! Ein Headset und ein Browser reichen voraussichtlich dafür aus.</p><p>Die Call-For-Papers Phase startet wahrscheinlich im August. Du solltest unsere letzten Tux-Tage verpasst haben? Kein Problem! Hier kannst Du alle Aufzeichnungen aus dem letzten Jahr ansehen.</p>	20220930	https://www.tux-tage.de/vortragen/	Community Event	Linux	Zero			DE	Volunteers								UTC+2	https://twitter.com/TuxTage	https://mastodon.online/@tuxtage2020												
GNU Guix Day Conference			20201122	20201122	GNU Guix Day Conference 2020	Guix Days	#Guix Days	https://guix.gnu.org/en/blog/2020/online-guix-day-announce-1/	online	/img/eventbanners/2020/2020-guix-days-online.png			On the internet				http://git.savannah.gnu.org/cgit/guix.git/tree/CODE-OF-CONDUCT	<p>The Guix hackers are very happy to announce the first online Guix Day Conference on Sunday November, 22nd. This conference is open to everyone and will be held entirely online. Want to speak? Submit your proposal!</p><p>Important dates:</p><ul><li>November 6th: Deadline for talks proposal.</li><li>November 14th: Deadline for releasing your pre-recorded talks.</li><li>November 16th: Release of the schedule.</li><li>November 22nd: Conference day!</li></ul><p>The agenda of the day is:</p><ul><li>pre-recorded talks with live question and answer sessions</li><li>birds of a feather (BoF) sessions</li><li>lightning round talks, if possible</li><li>hack together</li></ul><p>There will be no presentation on the 22nd! And no registration fee.</p>	20201106	https://guix.gnu.org/en/blog/2020/online-guix-day-announce-1/	Project Event	Guix, GNU, scheme, distribution	Zero	no	?	EN	Guix Hackers					https://audio-video.gnu.org/, IRC	pre-recorded talks with live question and answer sessions in preparation of an hackathon	Highly FOSS and Free Culture friendly: pre-recorded talks are presented on audio-video.gnu.org, q&a is happening on IRC.															
OSS2021			20210512	20210513	17th International Conference on Open Source Systems			https://www.oss2021.org/	offline		Lahti	FI	LUT University Lahti Campus	https://www.openstreetmap.org/node/1918633172	61.00651	25.65507		<p>The 17th edition of the International Conference on Open Source Systems (OSS 2021), true to the conference traditions, will be a holistic forum on the advances in the theory and practice of FLOSS, for people from very diverse backgrounds. All traditional OSS topics will be covered and welcome (see full list below). In addition, OSS 2021 will have a special focus on large-scale open source, covering topics such as, but not limited to:</p><ul><li>The use of FLOSS in large organizations, including private for-profit corporations, major non-profit organizations, large public administrations, etc.</li><li>The migration to FLOSS from proprietary systems in said large organizations.</li><li>The development and maintenance of very large FLOSS systems, such as individual software products made of multi-million lines of code or entire software ecosystems encompassing tens of thousand components.</li><li>The study and analysis of very large FLOSS systems, as defined above, focusing on traits such as evolution, quality, and health, of both the systems themselves and the associated communities.</li><li>Wide-area collaboration and peer production using FLOSS and/or aimed at developing them. Due to the ongoing COVID-19 pandemic, experience reports about how FLOSS systems have enabled remote work, remote conferences, or remote collaboration will be particularly welcome.</li></ul><p>OSS 2021 will bring together people from industry and academia to share experiences and ideas as well as to provide an archival source for scholarly papers on FLOSS topics. The conference will also inform and educate practitioners, identify directions for further research, and offer a platform for ongoing technology transfer.</p>	20210103	https://www.oss2021.org/track/oss-2021-papers	Science Event	foss,floss	?			EN																							
May Contain Hackers			20220722	20220726	May Contain Hackers	MCH2022	#MCH2022	https://mch2022.org/	offline	/img/eventbanners/2021/2021-may-contain-hackers.png	Zeewolde	NL	Scoutinglandgoed Zeewolde	https://osm.org/go/0E65_AaQ?layers=HN&m=	52.2843	5524		<p>The camp is organized for and by volunteers from and around all facets of the international hacker community. It attracts about 3500 hackers from all around the globe. Knowledge sharing, technological advancement, experimentation, connecting with your hacker peers and of course hacking are some of the core values of this event. During the camp there are hundreds of talks and activities to participate in.</p><p>MCH2022 is an international non-profit outdoor hacker camp/conference taking place in The Netherlands in 2022 on July 22rd to 26th. It is the successor of a string of similar events happening every four years: GHP, HEU, HIP, HAL, WTH, HAR, OHM and SHA. Similar events are EMF in the UK, CCC Camp in Germany.</p>	20220201	https://conference.mch2022.org/mch2021-2020/cfp	Camping, Community Event		333,33 €	yes	3500	EN	Volunteers	Villages: Any size of community can announce a space for themselves. 	1989							https://twitter.com/MCH2022Camp	https://chaos.social/@mch2022camp												
preCICE2022			20220222	20210225	preCICE Workshop 2021	preCICE2021	#preCICE2021	https://precice.org/precice-workshop-2022.html	online	/img/eventbanners/2021/2021-precice.svg			On the internet					<p>The second workshop of the free simulation coupling library preCICE</p><p>Continuing from the success of the preCICE Workshop of February this year, we are pleased to announce the 2nd preCICE Workshop to be held from the 22nd to 25th of February 2021 online. The workshop in February showed us the diversity of users from across the globe, and we are excited to continue to interact with all users/developers/interested-persons and enthusiasts of preCICE.</p><p>We will once again be including a mixture of talks, including developer and user talks, and hands-on workshop sessions.</p>	20210107	https://www.precice.org/preCICE2021/	Science Event	preCICE, multi-physics simulations, fluid-structure interaction, OpenFOAM, CalculiX, deal.II, FeniCS	50€ (early registration), 100€ (late), possibility for exemption	yes	40	EN	University of Stuttgart		2020 (offline)			BigBlueButton	Q&A, breakout rooms	To be defined.	UTC+1	https://twitter.com/preCICE_org 			https://github.com/precice/										
Univention Summit			20220517	20220518	Univention Summit			https://www.univention-summit.com/		/img/eventbanners/2022/2022-univention-summit.svg	Bremen	DE	Metropol Theater	https://www.openstreetmap.org/way/229201068	53.07845	8.81426		The topic of digital sovereignty for companies, the education sector and public administration is more relevant than ever and more and more projects are starting to make it a reality. At the Univention Summit 2022, well-known drivers and those responsible for digitization will give insights into ongoing and planned projects and the successful use of open source solutions. From Phoenix, Gaia-X and Possible, through the national education area to BILDUNGSLOGIN - so much happens. Also we will focus of course the roadmap of UCS and UCS@school and the presentation of our numerous technology and project partners.			Community Event	Univention, Phoenix,Gaia X	30 Euro	https://www.univention-summit.com/registration/	?	EN	Univention Gmbh								UTC+1														
The EU Open Source Policy Summit	1672926576	yes	20230203	20230203	The EU Open Source Policy Summit 2023			https://summit.openforumeurope.org/	hybrid	/img/eventbanners/2023/2023-policy-summit.png	Brussels	BE	Sparks	https://www.openstreetmap.org/?mlat=50.84545&mlon=4.35910#map=19/50.84545/4.35910	50.84545	4.35910		<p>The EU Open Source Summit 2023 is an online and in-person conference. Taking place the day before FOSDEM in Brussels, it brings together Open Source and policy experts for speeches and panels that will be streamed to a global audience online.</p>			Policy Event		?	https://summit.openforumeurope.org/	While online editions have attracted over 1000 participants, the last in-person edition happened in 2020 and gathered over 130 participants in Brussels.	EN	Open Forum Europe		2015	Eclipse Foundation, RedHat, Suse	Open Source & the Grand Challenges		online chat and onsite participation	To be defined.		https://twitter.com/OpenForumEurope													
MozFest Virtual	1667504124	yes	20230320	20230324	MozFest Virtual			https://www.mozillafestival.org/en/	online				On the internet					<p>MozFest is a unique hybrid: part art, tech and society convening, part maker festival, and the premiere gathering for activists in diverse global movements fighting for a more humane digital world.</p><p>Over the last ten years, MozFest has fueled the movement to ensure the internet benefits humanity, rather than harms it. As the festival matures and moves online for this year, we’ll remain focused in our work to build a healthier internet and more Trustworthy AI. Save the date for MozFest 2021 where the brightest minds and most ambitious ideas from the internet health movement will come together under one roof.</p>			Community Event, Festival	Mozilla	?	yes	More than 3000	EN	Mozilla Foundation																						
MozFest House	1667504423	yes	20230608	20230610	MozFest House			https://www.mozillafestival.org/en/	offline		Amsterdam	NL						<p>MozFest is a unique hybrid: part art, tech and society convening, part maker festival, and the premiere gathering for activists in diverse global movements fighting for a more humane digital world.</p><p>Over the last ten years, MozFest has fueled the movement to ensure the internet benefits humanity, rather than harms it. As the festival matures and moves online for this year, we’ll remain focused in our work to build a healthier internet and more Trustworthy AI. Save the date for MozFest 2021 where the brightest minds and most ambitious ideas from the internet health movement will come together under one roof.</p>			Community Event, Festival	Mozilla	?	yes	More than 3000	EN	Mozilla Foundation																						
Reboot to Respawn			20210402	20210405	Reboot to Respawn (r2r)			https://di.c3voc.de/r2r:start	online	/img/eventbanners/2021/2021-ReboottoRespawn-rocket.png 			On the internet					<p>It is a very dangerous game we’re playing on our planet, and although we seem to realize, at least from time to time, that we’re destroying the planet, we still keep pressing “continue”. The media are only talking about the pandemic and if and when the next vaccinations are due. At the same time the general impression is that if only this pandemic was over then everything would be just fine again. But we know better: The Climate Crisis is looming large, and it’s a much greater danger, for which there will be no vaccination available, whichever way, nor will any simple lockdown help. No, the only thing that will help is a full reboot – politically, economically, socially and culturally. We only have this one planet as our hardware, and our life support is running low.</p><p>To be honest, the argument if we should be doing something about this is concluded. What we need now is to talk about what to do, and when and how to do it. Which brings us to the theme of this Easter time DiVOC “Reboot to Respawn”.</p><p>Accordingly, we’re particularly looking forward to submissions that deal with tangible proposals. We’re talking social themes here, but also traffic and city planning, economy and work, the environment in general and the agroindustrial complex in particular, and which technical solutions we could use to hack them. And that includes, of course, art and cultural aspects, because we’re in need of those, too, so we’re also looking for submissions in this field.</p><p>>And of course we’re still the Chaos, and part of our own culture are submissions on printers on fire, on blinking lights, on toots, tweets, honks and waving cats. Even in the darkest hours of the pandemic we want to have fun with our devices, we want to socialize and hack together and show each other the cool stuff we’ve been doing.</p><p>That goes particularly well with some good music, so give us your proposals and your music lists, so we can relax in the lounge or maybe do some after-work shakin’ …</p><p>So long, and thanks for all the fish.</p>	20210227	https://pretalx.c3voc.de/divoc-reboot-to-respawn-2021/cfp	Community Event, Festival		?	?	?	DE	Chaos Computer Club								UTC+2														
Berlin Buzzwords			20220612	20220614	Berlin Buzzwords	bbuzz	#bbuzz	https://2022.berlinbuzzwords.de/		/img/eventbanners/2022/2022-berlin-buzzwords.png 	Berlin	DE	Kulturbrauerei	https://www.openstreetmap.org/way/32294784	52.53925	13.41381	https://2022.berlinbuzzwords.de/code-conduct	Berlin Buzzwords is Germany's most exciting conference on storing, processing, streaming and searching large amounts of digital data, with a focus on open source software projects.			Community Event		160 Euro	https://2022.berlinbuzzwords.de/registration	?	EN	plain Schwarz UG									https://twitter.com/berlinbuzzwords					https://www.linkedin.com/showcase/berlin-buzzwords								
stackconf	1667258527	yes	20230913	20230914	stackconf			https://stackconf.eu/	offline	/img/eventbanners/2023/2023-stackconf.png	Berlin	DE	NH Berlin Alexanderplatz	https://www.openstreetmap.org/way/29056578	52.52314	13.43796	https://stackconf.eu/code-of-conduct/	stackconf is about open source infrastructure in the spectrum of CI/CD, container, hybrid and cloud solutions. Today businesses have to meet the challenging requirements of an accelerated digital age, with virtual infrastructures and multi-channel platforms as the new normal. Bridging the gap between development, testing and operations is one of the fundamental paradigms in modern IT. stackconf covers these concepts from multiple perspectives.			Business Event		799,00 €	https://stackconf.eu/tickets/	> 100	EN	NETWAYS Event Services GmbH			B1 Systems, NETWAYS Web Services, SMSEagle, GT, Linux Magazin					UTC+2	https://twitter.com/search?q=stackconf													
