label	id	approved	datestart	dateend	name	shortname	hashtag	homepage	presentation form	onlinebanner	city	country	venue	OSM-Link	lat	lon	coclink	Self-description	cfpdate	cfplink	type	tags	EntranceFee	Registration	ParticipantsLastTime	Main language	Main Organiser	Specialties	First Edition	Main Sponsors	Edition’s Topic	Technologies in use	Online Interactivity	Technical Liberties	Timezone	Twitter	Mastodon	Telegram	Git*	Instagram	LinkedIn	Facebook	Youtube	Matrix	Mailinglist	cancelled	replacement	replaces	cancellation_description
license:	All data in this file is published as Open Data, you are free to reuse it as long as you credit “// foss.events” and you republish the data under the same licence. Read the details at: https://foss.events/about.html#datalicense																																																
																																																	
DevConf.cz	1672955811	yes	20230616	20230618	DevConf.cz		#devconf_cz	https://www.devconf.info/cz/	hybrid		Brno	CZ	Faculty of Informatics Masaryk University	https://www.openstreetmap.org/way/761057736	49.20999	16.59885	https://www.devconf.info/coc	<p>DevConf.CZ is annual, free, Red Hat sponsored community conference for developers, admins, DevOps engineers, testers, documentation writers and other contributors to open source technologies. At DevConf.CZ, FLOSS communities sync, share, and hack on upstream projects together.</p><p>DevConf.cz Mini is a bi-annual, highly focused, local, in-person version of DevConf.cz. It offers an opportunity to return to our conference themes in a smaller setting and establishes a platform for the Czech Republic and EMEA based community to sync, share and hack on upstream projects together.</p><p>There is no admission or ticket charge for DevConf.CZ events. However, you are required to complete a free registration. Watch this site for updates about registration.</p><p>We are committed to fostering an open and welcoming environment at our conference. We set expectations for inclusive behavior through our code of conduct and media policies, and are prepared to enforce these.</p>	20211001	https://cfp.devconf.info/	Community Event	Red Hat	Zero	yes	?	EN	Red Hat		2009	Red Hat 		?	?	?	?	https://twitter.com/devconf_cz		https://t.me/devconfcz	https://github.com/devconfcz/devconf		https://www.youtube.com/channel/UCmYAQDZIQGm_kPvemBc_qwg								
Open Confidential Computing Conference	1672955821	yes	20230315	20230315	Open Confidential Computing Conference	OC3	#OC3	https://www.oc3.dev/	online				On the Internet				https://www.oc3.dev/code-of-conduct	<p>OC3 is the conference for the open-source confidential computing community. Join core committers and contributors, new and advanced users, as well as thought leaders to share experiences and best practices in confidential computing. Learn more about the latest innovations in the ecosystem, updates of current projects, and the future of this powerful technology.</p>				Security,Confidential Computing	Zero	https://www.oc3.dev/#registration	400	EN	Edgeless Systems		2021			?	?	?	?	https://twitter.com/EdgelessSystems					https://linkedin.com/company/edgeless-systems								
State of Open Con	1674399109	yes	20230207	20230208	State of Open Con 2023	SOOCON23	#soocon23	https://stateofopencon.com/	offline		London	UK	Queen Elizabeth II Center	https://www.openstreetmap.org/relation/8244903	51.50064	-0.12922	https://openuk.uk/wp-content/uploads/2020/08/Code-of-respect-Final-Aug-20.pdf	<p>The UK's Open Technology Conference, Open Source Software, Open Hardware & Open Data</p>			Community Event		£199	https://stateofopencon.com/tickets/		EN	Open UK									https://twitter.com/openuk_uk													
XMPP Summit	1671527834	yes	20230202	20230203	25th XMPP Summit		#xmpp	https://wiki.xmpp.org/web/Conferences/Summit_25	hybrid	/img/eventbanners/2023/2023-xmpp-summit.png	Diegem	BE	Cisco System Belgium	https://www.openstreetmap.org/way/641537289#map=16/50.8862/4.4415	50.8867	4.4483	https://xmpp.org/extensions/xep-0458.html	The XMPP Standards Foundation (XSF) will hold its 25th XMPP Summit in the two days preceding FOSDEM 2023, 2 & 3 February 2023.		https://wiki.xmpp.org/web/Conferences/Summit_25#Agenda	Project Event	XMPP	Zero	https://wiki.xmpp.org/web/Conferences/Summit_25#Summit_Participants	20	EN	XMPP Standards Foundation		2006							https://twitter.com/xmpp	https://fosstodon.org/@xmpp		https://github.com/xsf										
P2P Basel	1674503612	yes	20230127	20230130	P2P Basel 2023			https://p2p-basel.org/	offline	/img/eventbanners/2023/p2p-basel.png	Basel	CH	Departement of Mathematics and Computer Science	https://www.openstreetmap.org/node/5228942689	47.56019	7.58716		<p>Secure Scuttlebutt (SSB) is an application-level, secure and persisted publish/subscribe system that has gained popularity in the decentralized Web movement. The aim of this workshop is to bring together researchers, software builders and members of the SSB community to study the properties and potential of Secure Scuttlebutt. The workshop is open to other decentralized approaches and networking technologies e.g. DAT, Holochain, IPFS or SOLID, as problems and technologies often have considerable similarities. Also, a SSB tutorial precedes the workshop, helping people to get familiar with the Secure Scuttlebutt technology and value system in short time.</p>			Unconference	scuttlebutt	20€ / day	https://p2p-basel.org/	?	EN																							
CHAOSScon Europe	1669156225	yes	20230203	20230203	CHAOSScon Europe	CHAOSSCon	#CHAOSSCon	https://chaoss.community/chaosscon-2023-eu/	offline		Brussels	BE	Bedford Hotel & Congress Centre	https://www.openstreetmap.org/node/2169733297	50.84422	4.34742	https://chaoss.community/about/code-of-conduct/	Learn about open source project health metrics and tools used by open source projects, communities, and engineering teams to track and analyze their community work. This conference will provide a venue for discussing open source project health, CHAOSS updates, use cases, and hands-on workshops for developers, community managers, project managers, and anyone interested in measuring open source project health. We will also share insights from the CHAOSS working groups on Diversity and Inclusion, Evolution, Risk, OSPO Metrics, Common Metrics, and Metric Models			Community Event	Metrics, Community Management, Analytics	10 $	https://opencollective.com/chaoss/events/chaosscon-2023-brussels-5c280300/contribute/chaosscon-2023-ticket-brussels-47861	~80	EN	Linux Foundation									https://twitter.com/CHAOSSproj	no												
OFFDEM	1673024735	yes	20230204	20230205	Ozone Fast Forward: Decolonizing Europe Matters	OOO3FFDEM	#OFFDEM	https://ps.zoethical.org/pub/offdem-ozone-cfp	offline		Brussels	BE	Collectif Zone Neutre	https://www.openstreetmap.org/#map=19/50.81359/4.39307	50.81359	4.39307		<p>OFFDEM strives to keep a single event line, where all participants have the chance to follow the whole event, in the form of a general assembly. This means there is no individual presentation. Meanwhile, there are many smaller spaces and the main group can split to focus on more specific issues. In this case, we kindly ask that such groups provide a constructive way to give back to the general assembly so that we can all benefit from their findings.</p><p>At OFFDEM we think preparing an encounter together is important. You are welcome to propose different formats to OFFDEM: it may be a concern to be approached during a collective meeting, a specific focus group to be organized in a dedicated room, a performative proposal or an installation in the form of question booth, documentation table, fanzinotheque, etc. OFFDEM is self-organized. All proposals are prepared and discussed collectively on the forum (we do not have a selection committee) until we reach an agreement on the public program.</p>		https://ps.zoethical.org/pub/offdem-ozone-cfp	Unconference	counter culture,feminism,diy	Zero	https://ps.zoethical.org/pub/offdem-ozone-cfp	~80	EN	Petites Singularités		2020	none							https://ps.s10y.eu/@ps												
FOSDEM	1666810819	yes	20230204	20230205	Free and Open Source Software Developers European Meeting	FOSDEM	#fosdem #fosdem23	https://fosdem.org/2023/ 	offline	/img/eventbanners/2023/2023-fosdem.png	Brussels	BE	Université Libre Bruxelles	https://www.openstreetmap.org/?mlat=50.81295&mlon=4.38002#map=18/50.81295/4.38002	50.81295	4.38002	https://fosdem.org/2023/practical/conduct/	<p>FOSDEM is a free event for software developers to meet, share ideas and collaborate.</p> <p>Every year, thousands of developers of free and open source software from all over the world gather at the event in Brussels.</p>	20221215	https://fosdem.org/2023/news/2022-11-13-call-for-presentations/	Community Event,Festival	Development,Community	Zero	no	FOSDEM is Europe's biggest annnual Free and Open Source gathering. Physical attendance has increased up to 8.000 in 2020 and the online versions 2021&2022 have seen a peak of 33.500 visitors online.	EN	Fosdem Team	"<ul><li>The largest and most known FOSS event in Europe;</li><li>The organisers offer <a href=""https://fosdem.org/2023/news/2022-11-07-accepted-developer-rooms/"">Developer Rooms</a> for FOSS communities that they can run on their own with their own schedule and call for participation;</li><li>The night before the first day of FOSDEM there is a “Beerdrinking” event with free as in free beer usually happening in Delirium in the city center;</li><li>FOSDEM is usually surrounded by various smaller and larger satellite events;</li></u>"	"<a href=""https://archive.fosdem.org/2001/index.html"">2001</a>"	Cisco, Colt, OpenTAP, Université Libre de Bruxelles		Matrix			UTC+2	https://twitter.com/fosdem	https://fosstodon.org/@fosdem			https://www.instagram.com/fosdem/		https://facebook.com/fosdem							
Config Management Camp	1672955822	yes	20230206	20230208	Configuration Management Camp	CfgMgmtCamp	#CfgMgmtCamp	https://cfgmgmtcamp.eu/	offline		Ghent	BE	HoGent - Campus SchoonMeersen	https://www.openstreetmap.org/?mlat=51.03425&mlon=3.70149#map=19/51.03425/3.70149	51.03425	3.70149	https://cfgmgmtcamp.eu/ghent2020/codeofconduct/	Configuration Management Camp is the event for technologists interested Open Source Infrastructure automation and related topics. This includes but is not limited to top Open Source Configuration Management, Provisioning, Orchestration, Choreography, Container Operations, and many more topics.	20221206	https://cfgmgmtcamp.eu/ghent2023/	Community Event	Infrastructure,Configuration Management	Zero	https://registration.cfgmgmtcamp.be/ghent/2020/	?	EN										https://twitter.com/cfgmgmtcamp													
Creative Freedom Summit	1674504079	yes	20230117	20230119	Creative Freedom Summit			https://creativefreedomsummit.com/	online				In the Internet					<p>On January 17th, 18th, and 19th, be part of the Creative Freedom Summit, the first virtual conference dedicated solely to the features and benefits of Open Source creative tools. Be inspired by fellow artists, designers, and makers, and learn how you can enjoy more creative freedom!</p>			Community Event	design	Zero	https://creativefreedomsummit.com/#join	First time	EN	Fedora Design Team		2023	Fedora, Red Hat																			
I love Free Software Day	1664996210	yes	20230214	20230214	I love Free Software Day	IloveFS day	#IloveFS	https://ilovefs.org/	online												Global Day	Love,Hugs,IloveFS																											
FOSS4G-IT	1676745561	yes	20230612	20230617	FOSS4G-IT 2020			https://foss4g-it2020.gfoss.it/			Bari	IT	Politecnico di Bari	https://www.openstreetmap.org/way/30705484	41.10922	16.87869		<p>FOSS4G is the acronym for Free and Open Source Software for Geospatial. It is the annual recurring global event hosted by OSGeo, the non-profit organization that supports and promotes the collaborative development of free and open source geographic technologies and open geospatial data. The conference covers all kinds of topics related to geospatial information and earth observation openness from Software development to Transition to FOSS4G, Use cases and applications, Education and research and Open data.</p><p>This event is for all kinds of people interested in sharing experiences about maps, from developers who write code to users of geomatics software, people who make decisions, researchers, students and anyone who wants to learn, share and meet like GIS interested people.</p><p>It attracts over 1,000 practitioners and advocates for free and open source software for geospatial and the tendency is to increase this number every year. It is the main meeting place and educational outreach opportunity for OSGeo members, supporters and newcomers - to share and learn from one another in presentations, hands-on workshops and a conference exhibition.</p>			Community Event	Wikimedia Italia			?	IT	Gfoss-it																						
Winterkongress	1676745566	yes	20230224	20230225	Winterkongress der Digitalen Gesellschaft	Winterkongress	#Winterkongress	https://www.winterkongress.ch/2023/	offline		Zurich	CH	Volkshaus	https://www.openstreetmap.org/way/28446822	47.37555	8.52743		<p>Der Winterkongress ist das jährliche Treffen der Digitalen Gesellschaft: Am Freitagabend, 24. und Samstag, 25. Februar 2023 kommen zum sechsten Mal Hacker, Programmiererinnen, Aktivisten und Interessierte in Zürich (vorübergehend) im Volkshaus zusammen, um sich zu den Themen rund um Informationstechnologie, der Vernetzung und deren Auswirkungen auf unsere Gesellschaft auszutauschen.</p>			Community Event	Informationstechnologie,Vernetzung,Gesellschaft	30 Euro	https://www.winterkongress.ch/2023/tickets/	~ 500	DE	Digitale Gesellschaft CH		2018																				
FOSS4G 2023	1666202555	yes	20230626	20230702	FOSS4G 2023		#foss4g	https://2023.foss4g.org/		/img/eventbanners/2023/2023-FOSS4G.png	Prizren	KO	Innovation and Training Park (ITP)	https://www.openstreetmap.org/way/724682623	42.2210	20.7489	https://2023.foss4g.org/code_conduct.php	<p>Organized by OSGeo and with more than 15 years of experience, this international annual gathering of location enthusiasts is the largest global gathering for geospatial software.</p><p>FOSS4G brings together developers, users, decision-makers and observers from a broad spectrum of organizations and fields of operation. Through six days of workshops, presentations, discussions, and cooperation, FOSS4G participants create effective and relevant geospatial products, standards, and protocols.</p>		https://2023.foss4g.org/call_for_paper.php			?	https://2023.foss4g.org/register/	?	EN	OsGEO																						
FOSS Backstage	1638232074	yes	20230313	20230314	FOSS Backstage			https://23.foss-backstage.de 	hybrid	/img/eventbanners/2023/2023-FOSSBackstage.png	Berlin	DE	Tuechtig	https://www.openstreetmap.org/node/4729031305	52.5533166	13.3596927	https://23.foss-backstage.de/code-of-conduct/	<p>The conference on everything related to governance, collaboration, legal and economics within the scope of FOSS. </p><p>Join us for two days of discussion and learning about non-technical aspects of open source development. Topics include open source project leadership best practices, community management, open source project metrics, open source strategy for enterprise, adopting open source collaboration in corporations, legal matters when dealing with open source and many more.</p>	20221106	https://program.foss-backstage.de/fossback23/cfp	Business Event	Community,Governance	120€	https://23.foss-backstage.de/tickets/	?	EN	Plain Schwarz		2018			?	?	?	UTC+2	https://twitter.com/fossbckstg					https://www.linkedin.com/showcase/foss-backstage								
Open Data Day	1676745562	yes	20230304	20230310	Open Data Day			https://opendataday.org/										<p>Open Data Day is an annual celebration of open data all over the world. Groups from around the world create local events on the day where they will use open data in their communities. It is an opportunity to show the benefits of open data and encourage the adoption of open data policies in government, business and civil society.</p><p>All outputs are open for everyone to use and re-use.</p>			Global Day																												
FOSSGIS-Konferenz	1669409421	yes	20230315	20230318	FOSSGIS-Konferenz	FOSSGIS	#fossgis	https://www.fossgis-konferenz.de/2023/	offline	/img/eventbanners/2023/2023-fossgis.png	Berlin	DE	Erwin-Schrödinger-Zentrum	https://www.openstreetmap.org/relation/2026048	52.43115	13.53109		<p>Die FOSSGIS-Konferenz ist die führende Konferenz für Freie und Open Source Software Geo-Software und OpenStreetMap.</p><p>Die FOSSGIS-Konferenz 2023 wird vom gemeinnützigen FOSSGIS e.V, der OpenStreetMap Community und dem Geographischen Institut der Humboldt-Universität zu Berlin veranstaltet und findet im Erwin-Schrödinger-Zentrum auf dem Campus Adlershof statt.</p><p>Ziel der jährlich stattfindenden Konferenz ist die Verbreitung von Freier und Open Source Software für Geoinformationssysteme sowie Open Data. Hier treffen sich Anwender:innen und Entwickler:innen zum gemeinsamen Austausch über Anwendungs-, Arbeits- und Weiterentwicklungsmöglichkeiten sowie neuste Entwicklungen in diesem Bereich. Es geht um Webmapping, Geodateninfrastrukturen, Geodatenmanagement, Geoprocessing, Geodatenanalysen und -modellierungen und Desktop-GIS und um freie Geodaten, wie OpenStreetMap. Themen wie Digitale Souveränität im Zusammenhang mit Open Source werden ebenso behandelt, wie Open Science und die FAIR Prinzipien.</p><p>Die Konferenz wird vorwiegend durch ehrenamtliches Engagement getragen, wobei neben den Teilnehmergebühren, die Spenden- und vor allem die Sponsoren- und Ausstellerstandeinnahmen eine wichtige finanzielle Einnahmequelle darstellen, um die Kosten für die Konferenz zu decken und darüber hinaus Open Source Projekte zu fördern.</p>	20221107	https://fossgis-konferenz.de/2023/callforpapers/	Project Event, Community Event	OpenStreetMap,GIS	"220 Euro / Zero for ""community members"""	https://www.fossgis-konferenz.de/2023/anmeldung/	500	DE	FOSSGIS e.V.		2003			https://matrix.to/#/!XajsOFLRhsznebfosT:matrix.org			UTC+1	https://twitter.com/fossgis_konf													
t3chfest	1676745563	yes	20230302	20230303	t3chfest		#T3chfest2020	https://t3chfest.es/2023/	offline		Madrid	ES	Auditorio Universidad Carlos III	https://www.openstreetmap.org/#map=18/40.33250/-3.76546	40.3325	-3.76546	https://t3chfest.es/2023/codigo-conducta/	<p>Vuelve el aprendizaje. Vuelve la comunidad. Vuelve la tecnología.</p>			Community Event	Hackathon,Programming	Zero	no	2000	ES			2013							https://twitter.com/t3chfest													
Chemnitzer Linux-Tage	1670336571	yes	20230311	20230312	Chemnitzer Linux-Tage 2023	CLT	#CLT2023, #CLT	https://chemnitzer.linux-tage.de/2023/en/	offline	/img/eventbanners/2023/2023-clt.png	Chemnitz	DE	Technische Universität Chemnitz	https://www.openstreetmap.org/way/30742889	50.81357	12.92928	https://chemnitzer.linux-tage.de/2023/en/info/miteinander	<p>In 2023 the Chemnitz Linux Days have found a place on a weekend in March again, still in a different form, namely virtual. Pick up your schedule and make a big mark on 11th and 12th of March 2023. You won't regret it.</p><p>We very much wish to see you again on site and hope that the situation in March will allow us to invite Linux and open source friends to Chemnitz in early 2023. Currently we are planning for an on site event in the usual environment. You can keep yourself up to date on this via our press releases and social media.</p>	20230104	https://chemnitzer.linux-tage.de/2023/en/programm/call-for-lectures	Community Event	Linux	?	?	3600 last time at the physical event in the Technische Universität Chemnitz. In the online editions in 2021 and 2022 up to 1500 visitors similtaneously.	DE	Individual Network Chemnitz e.V.	"Tech support in <a href=""https://chemnitzer.linux-tage.de/2022/en/addons/praxis"">Surgery Dr.Tux</a>"	1999		Bewusst sein				UTC+2	http://chemnitzer.linux-tage.de/twitter	https://mastodon.social/@clt_news					https://chemnitzer.linux-tage.de/facebook							
Libre en Fête	1676745564	yes	20230320	20230320	Libre en Fête			https://www.libre-en-fete.net/2023/				FR					nococ				Regional Day				?																								
Ansible Contributor Summit Europe			20200329	20200329	Ansible Contributor Summit Europe			https://www.eventbrite.com/e/ansible-contributor-summit-eu-registration-92039844653			Gothenburg	SE	Chalmers Conference Centre	https://www.openstreetmap.org/node/6390774037	57.68926	11.97338	https://docs.ansible.com/ansible/latest/community/code_of_conduct.html	The Ansible Contributor Summit is a full day of working sessions with the Ansible core team and community contributors. This year the European edition will be held in Gothenburg, in conjunction with foss-north 2020,as part of the Community Day.			Community Event	ansible	Zeroi	Yes	100	EN	Ansible (Red Hat)									https://twitter.com/ansible													
openSUSE Summit Dublin			20200327	20200328	openSUSE Summit Dublin	openSUSE Summit		https://events.opensuse.org/conferences/Dublin			Dublin	IE	Convention Centre	https://www.openstreetmap.org/way/60270053	53.34823	-6.23953		The openSUSE Conference begins Friday, May 24, at 10 a.m. and will finish on Sunday, May 26. The openSUSE Conference is the annual openSUSE community event that brings people from around the world together to meet and collaborate. The organized talks, workshops, and BoF sessions provide a framework around more casual meet ups and hack sessions. A party here and there provides the time to relax and have fun, making connections on a more personal level.	20200214	https://events.opensuse.org/conferences/Dublin/program/proposals/new	Project Event	OpenSUSE,Dublin	?	https://events.opensuse.org/conferences/Dublin/register/new	?	EN	OpenSUSE									https://twitter.com/opensuse													
KubeCon + CloudNativeCon Europe			20200330	20200402	KubeCon + CloudNativeCon Europe			https://events.linuxfoundation.org/kubecon-cloudnativecon-europe/			Amsterdam	NL	RAI Amsterdam Convention Centre	https://www.openstreetmap.org/way/548207841	52.34051	4.88892	https://events.linuxfoundation.org/kubecon-cloudnativecon-europe/attend/code-of-conduct/	The Cloud Native Computing Foundation’s flagship conference gathers adopters and technologists from leading open source and cloud native communities in Amsterdam, The Netherlands from March 30 – April 2, 2020. Join Kubernetes, Prometheus, Envoy, CoreDNS, containerd, Fluentd, TUF, Jaeger, Vitess, OpenTracing, gRPC, CNI, Notary, NATS, Linkerd, Helm, Rook, Harbor, etcd, Open Policy Agent, CRI-O, TiKV, CloudEvents and Falco as the community gathers for four days to further the education and advancement of cloud native computing.	20191204	https://events.linuxfoundation.org/kubecon-cloudnativecon-europe/program/cfp/	Business Event	Kubernetes, Prometheus, Cloud	450$	https://events.linuxfoundation.org/kubecon-cloudnativecon-europe/register/	?	EN	Linux Foundation																						
Document Freedom Day			20200325	20200325	Document Freedom Day			https://en.wikipedia.org/wiki/Document_Freedom_Day													Global Day																												
Erlanger Linuxtag	1674502303		20230520	20230520	Erlanger Linuxtag	erlug	#erlug	https://erlug.de/erlanger-linux-tag-2023/	offline		Erlangen	DE	VHS-Erlangen: Café International	https://www.openstreetmap.org/way/104783535#map=19/49.59752/11.02464	49.59752	11.02464	nococ	<p>Im Mai ist es wieder soweit! Endlich können wir wieder live einen Linux-Tag veranstalten. Egal, ob Du Dir Linux erstmal anschauen möchtest oder schon Linux Nutzer bist: Am 20. Mai 2023 findest Du genug Gelegenheit für Austausch und Inspiration!</p><p>Call for Papers/Presentations: Gesucht werden noch Vorträge und Workshops zu allen Themen rund um freie Software, Linux, die Open-Source-Community, freie Kultur und Open Data, Netzpolitik und Schutz der Privatsphäre, Erfahrungsberichte und Geschäftsmodelle und Best Practices. Die Vorträge werden aufgezeichnet und danach der Allgemeinheit zur Verfügung gestellt.</p><p>Wir freuen uns über Deine Einsendung! Ende der Einreichungsphase ist der 26. März.</p>	20230326	https://erlug.de/erlanger-linux-tag-2023/	Community Event	Linux	?	?	?	DE	Erlanger Linux User Group										https://social.anoxinon.de/@erlug												
Kubernetes Contributor Summit Europe			20200329	20200330	Kubernetes Contributor Summit Europe			https://events.linuxfoundation.org/kubernetes-contributor-summit-europe/			Amsterdam	NL	RAI Amsterdam Convention Centre	https://www.openstreetmap.org/way/548207841	52.34051	4.88892			20200207	https://docs.google.com/forms/d/e/1FAIpQLSfTv0YcPDomj5vPsMEodv9xS3Zd6CZWDVMcL0kGF8FjL9ADDA/viewform	Project Event	Kubernetes			?	EN	Linux Foundation																						
foss-north			20220420	20220421	Foss-north 2022		#fossnorth	https://foss-north.se/2022/	online	/img/eventbanners/2022/2022-Foss-north.png			On the Internet				https://foss-north.se/2022/coc.html	foss-north is a free / open source conference covering both software and hardware from the technical perspective. Hosted in Gothenburg between Copenhagen, Oslo, and Stockholm, with an international airport, we provide a meeting place for the Nordic foss communities and will bring together great speakers with a great audience.			Community Event	floss,foss				EN																							
